,text,aspect,label
0,can you check whether its cancelled completely,cancelled,1
1,cannot rely both milk delivery and grocery items,Milk,0
2,get notification however the really fine,notification,0
3,love this but would love even more gantt charts and calendar view were available iphone,view,1
4,does not let load clip the scene,load,0
5,love notion tool but the mobile just takes way long load,"tool,",2
6,unlimited yearly year,yearly,1
7,some times missing deliver some times different orders are delivered,"deliver,",0
8,would love the ability delete deleted tasks from the easy find menu option,tasks,1
9,please this basic feature,Please,2
10,wanted download the,app,0
11,want learn for the future whether team something wrong whether teammate accidently deleted the file therefore would good get the mailadress kaiser got hacked whether there was failure the notion system,learn,1
12,the desktop version simply awesome comparatively,desktop version,2
13,must support androids multi window api would better tablets and resize the the screen,Androids,0
14,prompt and reliable service,Prompt,2
15,ensure customers are getting delivery everyday inform them advance case delivery failure,delivery,0
16,the ease ordering timely delivery and best part can use the vacation option when not home suggestion should increase the variety products sold,"ease of ordering,",2
17,you can the exported tab only the exported videos,exported,1
18,you can use istock media only month,iStock,1
19,just used the for mins ios and crashed once date selection impossible options are seemingly using white font white background the doesn look good dark mode this the reason for the white white issue,UI,0
20,thought linked databases were favourite feature notionhq,databases,1
21,there difference between you and the regular milkman who infacts charges less delivery charges,delivery charges.,0
22,items missing not logical for the locations,Items missing,0
23,wonderful,app,2
24,can look into this for you could you share the url name the page,share,1
25,sometimes entries databases disappear and have restart the able load again,time,0
26,you have used our day trial and not cancel the subscription from your side and were thus charged,cancel,0
27,have increased using browser but the layout generally broken around there native way,layout,0
28,doens not start only,Doens't,2
29,hello recently purchased the business plan with promo code for the year,Business plan,1
30,but its not entirely optimised for android suppose there are many bugs,android,0
31,have added that domain that workspace end,workspace,1
32,how even know what get plan,plan?,1
33,love the program only the mobile and ipad the filter view doesn work practical the desktop version,filter,0
34,option delivery time after,option of a delivery,0
35,uoload can remove the background,background,1
36,would lot better was more offline,offline app.,0
37,also the membership professional which longer exists,membership,0
38,lags only that the big issue,lags,0
39,notion has become what evernote could not,note,2
40,the nice but there nuisance follows why still applicate mail,MAIL,0
41,does load correctly incognito,load,0
42,try import large amount notes from evernote,notes,0
43,punctuality well keeing update,Punctuality,2
44,reduce products rates reduce service charges,service charges.,0
45,when download the video will people able click the link watch the video how will they watch the video,download,1
46,want voice the video,voice,1
47,understand that you want able the toggle todo number list one control unit,list,1
48,not understand english well,English,1
49,first the loading time for opening the needs improve next that instead having click lot buttons highlight phrase such clicking color and then having click again and choose color would more efficient highlight phrase and then one click for highlighted just like striking phrase,phrase,0
50,talking about the offline mode which you can work something for couple hours and the will log out itself and you lose everything,offline mode,2
51,you can cancel your plan from subscription plan page from your laptop and desktop,cancel,1
52,action database manipulation life hacks series phmaesdnghnaa acti,Database,1
53,colleague has paid subscription why get claim,paid,1
54,those promocodes are not valid,promocodes are not valid,0
55,what going there are serious issues using this software incognito window not previews not loading editing trim video function and previewing videos with missing clips when can expect this addressed,"loading,",0
56,timely updates case product not being delivered getting delayed,Timely updates,0
57,before render when compose its alright but after render comes some places little smaller,render,1
58,this just what needed for crafting supplies just love,crafting supplies,1
59,freezes even small base mostly good but the often hangs when regaining system focus even with small base few tables few dozen records attachments,records,1
60,can not open the file,file,0
61,but the not,app,0
62,how unsubscribe,unsubscribe,1
63,please lock secure sensitive information,secure sensitive information.,0
64,very bad service for the essentials thing like milk,"service,",0
65,why the priority not displayed mobile versions,priority,0
66,maintain proper temparature milk pocket vegetables also not fresh,vegetables,0
67,was overall good experience but lack offline mode sucks,offline mode,0
68,perfect for project management,project,2
69,that video both scenes,scene,1
70,immediate solution queries,No immediate solution,0
71,grocerry varities,&grocerry,0
72,good and excellent service,Good,2
73,its about the lowest vasilescu pro solutions text the scene that should have the overlay over before fades away,fades,1
74,love everything about notion but you guys have such terrible,app,2
75,the delivery very haphazard,delivery,0
76,packaging biscuits bakery and dairy products very poor,dairy products,0
77,and editing video that long requires more speed and that something that difficult for most users,speed,1
78,journals gtd cookbooks whatever,"GTD,",2
79,the product really good but the needs optimisation,app,0
80,when click the reading notes the table reading list like direct directly the page the reading note,table,1
81,cuando agregaran idioma espanol,cuando,2
82,time maintenance and hard working your team,Time maintenance,2
83,have used notion desktop wanted try out iphone however the already does not open first time downloading,app,0
84,this sucks,app,2
85,best productivity tools,Productivity,2
86,very practical for organizing tasks and connecting the team well stimulating productivity large scale,connecting,2
87,varying product ranges,product ranges,2
88,send the insulated bag for milk,milk,0
89,good afternoon team just want cancel this subscription please are getting billing coming into our accounts but have idea which email linked,subscription,1
90,delivery process full surprises,Delivery process,0
91,little timelapse video organising notionhq and outlining novel,organising,1
92,when try copy the link page gives option share other apps,apps,0
93,super useful relational database,database,2
94,not need old account anymore and unfair pay for,pay,0
95,supr daily bag was not provided assured the time joining,Supr daily bag,0
96,its per scene the music plays the first scene and for scenes and the video plays the background music volume set now,scene,1
97,each and every time need wait for milk until morning,milk,0
98,just found this accidentally and easy use make any mind mapping just using the bullet points and will generate,app,2
99,not put raw fruits like gava chiku mosambi for delivery becoz,Mosambi,0
100,this deserve more download,app,2
101,can not get the previews load whether its with istock videos from yur library own,previews,0
102,delighted your apt reply from support team via email within minutes notionhq,support,2
103,notionhq can you expand the header cells support please,support,1
104,have just started working with this software decided download the,"PC,",2
105,then click your profile icon the right and the projects page,project,0
106,the notion website application awesome but find the not easy use,notion website application,2
107,you want make the most out this browse templates online that suit your work flow best,app,2
108,startup seems getting slower and slower,Startup,0
109,want edit videos one screen,edit,1
110,the new update took away the ability swipe tasks delete complete reschedule,tasks,0
111,proper delivery since week,delivery,0
112,there could sync easy move evernote files yrs notion,Evernote,1
113,free delivery became now paid and then service for other milk products not acceptable and should immediately revoke,delivery,0
114,great for creating tasks and tracking them,tracking,1
115,have reinstall but performed same,reinstall,1
116,but does not even start,even,2
117,where insulated bag that you promised,insulated bag,0
118,can not rearrange properties table windows desktop,desktop.,0
119,iphone does not work next the first screen does not,Iphone,0
120,have always been evernote user but decided try notion out after seeing some people praising twitter,Notion,0
121,have set templates that populate each day when,templates,1
122,one incidence supply communication for five days,communication,0
123,for subscriptions ensure delivery happens daily its not even miss single day now that you even charge extra for each delivery,delivery,0
124,the new update much improves experience but more needs done make the more usable and much stronger competitor other productivity apps,productivity apps.,0
125,learn about this site from product management class accidentally found that there are apps although this lesson not how understand but least website and still help lot,website,1
126,absolutely phenomenal this freaking love this much might join this company one day,app,0
127,please provide free delivery for the products,free delivery,0
128,features access curated templates full access image library full access standard video library istock images and videos free access creator club premium templates,free,1
129,will need swap monthly can upgrade annual after pay,pay,2
130,easy use for cataloguing items,cataloguing items,2
131,just uploaded image the logo section,logo,1
132,offers for regular subscribers,offers for regular subscribers,0
133,notion amazing desktop but near unusable,app.,2
134,productivity does not have the ability send push notifications time,push notifications,0
135,historical research which leads use characters from various languages for page titles,search,1
136,can you please help and give access more istock clips,access,1
137,also widgets,WIDGETS!,0
138,started with chrome for the web clipper since most notion users are chrome but safari certainly the list,Safari,1
139,this can the greatest thing,app,0
140,versatile that need spreadsheet chart even just shopping list for snacks can create that,"chart,",2
141,that one area where this fails,app,0
142,this most likely due the size the database,database,1
143,look the layers panel the text locked unlock then,text,1
144,you mean invideo itself does not work mobile,mobile?,1
145,prompt customer friendly quick customer service for complaints,customer service,2
146,think would nice have plan that does not renew each moth,renew,1
147,pour les notes vous etes plutot evernote msonenote notionhq,les,1
148,tried that but the export seemed get stuck,stuck,0
149,colums mobiles and ios,ios,0
150,can screen but the overlay with the spinning circle never goes away and not able click the page,"screen,",1
151,love notion the mac seriously the best,Notion,2
152,rly good but after one the updates deleting the row with the swipe has disappeared and shame,updates,0
153,you have long product list but availability very poor,availability,0
154,one more question have pay separate enterprise license for every workspace use,workspace,1
155,the packing,packing,2
156,have spent endless hours many apps trying understand their features workflows settings etc and making life fit them,settings,1
157,but never started with black screen comes automaticaly before running into the first image,image,1
158,please share screenshot the left panel with text tab selected,screen,1
159,milk delivery boy telling will not door delivery milk you will have keep bag near society security cabin,delivery boy,0
160,prompt and timely delivery,timely delivery,2
161,even your customer care team confirmed that they will check the issue and still response,customer care,0
162,not optimised for tablet,optimised,0
163,this not only really behind the desktop version but bugs keep popping including regressions,desktop,1
164,love the desktop version but this wait time mobile making think should uninstall,desktop version,2
165,there way delete tasks new update,delete,0
166,want create notion form this pdf but can only create just checkboxes normal text cells,checkboxes,1
167,also love that can use this for managing small business from operations product development marketing and customer experience,app,2
168,but when you start explore and engage more through the gets really easy and truly life saver,"app,",2
169,notion amazing both useful and beautiful tool and this enough for using phone for,Notion,2
170,great help our projects stay track,projects,2
171,nice however would like request zoom feature for mobile users let zoom into photos,app,0
172,what about images color,images,1
173,not just note taking,note,2
174,the workspace was named amoshh workspace,workspace,1
175,packets milk and butter are dirty,butter,0
176,prompt delivery professional delivery partners products are good quality with some exceptions which redressed timely,"delivery,",2
177,remove sound from video clip,remove sound,1
178,can sign log,sign,0
179,would nice able the equivalent sql where rollup,Rollup.,2
180,request generate scim api token for workspace daf,API,1
181,introduction delivery fees per pack milk delivery paves way for customers buy directly from shops milk vendor delivery,milk delivery,0
182,when click the button have through survey,"button,",1
183,better quality fruits and vegetables eggs,quality of fruits,0
184,does this mean will not charged vat,charged,0
185,multiple and large variety catelog items,variety catelog of items,2
186,timely delivery easy use reasonable rates,app,2
187,airtable amazing because the views but you can not use kanban view the ipad preferable use the web version safari take advantage,web version,1
188,signed today and cancelled subscription and would like refund,cancelled,1
189,items rate and availability,Items rate,2
190,the fifth star when offer made for families the pricing structure suitable for companies,companies,1
191,get better service and deliver and not charge for deliveryb,deliver,0
192,use the digital todo list organize collaboration small teams,teams,1
193,every time try edit page create link the tools keyboard flash for half second and close back down,edit,0
194,what originally happened was that had large amount information and text which organised into different pages topic operations topic,organised,0
195,love the way the tables work,tables,2
196,initially rupees was charged extra milk subscription and this was subsequently returned super credits,milk subscription,0
197,and switching com,switching,1
198,wonder notion site searchable when search google naver for yoke randomly specified notion site title,searchable,1
199,smart delivery,Smart,2
200,you can increase your stock most the time when are need anything like milk even out stock what the meaning order things till,milk,0
201,the drag the video the canvas when you will show you trimmer,trim,1
202,would possible give access the beta version notion,Beta,1
203,adjusting that volume and nothing happening even tied downloading,downloading,0
204,enter the italian language,language,1
205,update works properly after following techadvice,Update,1
206,promptness ontime price,Price,2
207,lot people are asking for more customizable color options our timeline view,timeline,0
208,condition milk packets has not been consistently good,milk packets,0
209,about some charges,charges.,0
210,will refund but please cancel the plan once and let know,cancel,2
211,try direct contact with the customer not through,direct contact with the customer,0
212,quality the veggies and fruits are hopeless,fruits,0
213,delivery guy must leave the milk bag the door and not the building gate,milk,0
214,awesome please please can you make widget that will allow lists stuff for today week etc like microsft does would make this perfection,widget,0
215,consistently for days not recieve milk and was notified the morning that milk will not delivered,milk,0
216,browser version great,Browser version,2
217,why takes forever load the video for preview editing,load,0
218,but would like adjust resize remove background etc,background,1
219,will another vote for notionhq been using them for organization for awhile now and just,organization,1
220,today asked login mobile,mobile.,1
221,overall good with amazing service have not found any issues with,app.,2
222,hope this will fixed also hope you pomodoro timer into the,pomodoro timer,0
223,bread comes squeezed with broken pieces butter comes fully melted because their proper ice box,butter,0
224,hello working project that requires displaying large amount json,data.,1
225,was not aware was deleting the whole journal,journal,1
226,possible get more discount for annually membership,membership.,1
227,would hate for its owner lose some their notes can avoided,notes,0
228,you told from the timeline,timeline,1
229,google docs and sheets have this,sheets,0
230,could crop some scenes but not preview,scenes,1
231,want close down support email address,email,1
232,fantastic and very capable,app,2
233,this screenshot what looks like,screen,0
234,still wonderful for managing work but the latest update rough,update,0
235,love this pieces,app,2
236,using iphone,Iphone,1
237,aesthetic database text tiled header more,header,1
238,does that only appear when video has been exported,exported,1
239,really love the design and functionality this,app,2
240,however they have done great job adding preset templates that help you get idea the potential,app,2
241,will send screen shot,screen,1
242,when suprdaily came society and put promotional canopy was promised that there would delivery charge ever,Suprdaily,0
243,the drafts can not removed from home page,removed,1
244,this the which was looking for,app,2
245,while the task option makes sense and got,task,2
246,your sidebar section displays parent pages within your workspace,workspace,1
247,how can embed image from link gallery template,gallery,1
248,need more offers coupons milk subscriptions,offers,0
249,can remove team member from,team,0
250,letting know advance you able deliver milk not,milk,0
251,stuck the splash screen,app,0
252,the scrolling through the screen,screen.,0
253,you continue use like bulls piss etc you will not get any more help from,off,0
254,nice for startup small company,company,1
255,have problem with the password,password,0
256,hello until now have tried this the windows desktop and the web chrome and edge,Desktop,2
257,files are not uploading,uploading.,0
258,heard great things however there android widget for notion which very disappointing rely quick view layout for fast notes,Android Widget,0
259,hello hrishikesh how does white labeling with invideo video editing software work,editing,1
260,great desktop dark mode and other functionalities are missing mobile,app,2
261,slow gets stopped the system the time maybe because uses lot ram and takes forever start sometimes never starts,App,0
262,love airtable but really wish the ipad had feature parity with the web version specifically with grouped views,iPad,0
263,functional easy use and collaborate with others good for work and home,collaborate,2
264,would you mind sending screen recording when you tried copy the contents and you can not copy,recording,1
265,timely delivery very good customer care,"Timely delivery,",2
266,the name was class notes think,notes,1
267,excellent productivity,app!,2
268,very inconvinient work with web links email addresses stored notion such copy from there paste somewhere else,Notion,0
269,its per scene the music plays the first scene and for scenes and the video plays the background music volume set now,volume,0
270,heard about this podcast,app,2
271,would like the back ground music for scene three also but there music for that scene,music,1
272,you can literally create entire workflow and productivity powerhouse within this one and delete the rest,workflow,2
273,criteria for order,order,2
274,what card has been charged,charged,0
275,have been using notion for two months now,Notion,2
276,need change delivery instructions customer service able help,Customer service,0
277,the great literally can recommend anyone,recommend,2
278,trying reset password for another account and tried send reset email but,reset,0
279,widgetss,widgets,0
280,more than months and still green bag has not come,green bag,0
281,please grant support access using the account you used reach out,support,1
282,the last number the web link when have the project open,web,1
283,supr daily promised give bag for keeping milk the morning one month subscription,bag,0
284,many items either not there the list some items the list can not ordered like amul butter gms kellogg cornflakes,Kellogg's cornflakes,0
285,this troubling times would like have products delivered however service has been erratic,products delivered,0
286,you can cancel your plan from subscription plan page from your laptop and desktop,cancel,1
287,would better can the project dashboard not only show percentage,project,1
288,crashes while setting and loading,setting,0
289,mobile phone can never set traditional chinese please pay attention the mobile phone group,Mobile,0
290,notion great but the android really does not feel that well designed,Notion,2
291,hello have subscribe for lift time plane but getting watermark project,watermark,1
292,concerning you should properly map premium plans unlimited,premium,0
293,lost added mobile version,Mobile,0
294,what going there are serious issues using this software incognito window not previews not loading editing trim video function and previewing videos with missing clips when can expect this addressed,editing,0
295,the best note taking,app!,2
296,sorry but the display cellphone getting really over zoom,display,0
297,the facebook videos are templates does this put black line next the video either side,Facebook,1
298,just found this accidentally and easy use make any mind mapping just using the bullet points and will generate,app,2
299,compared microsoft access this thing toy many pictures and not enough function,many pictures,0
300,the covid environment with remote working this has increased team productivity and has allowed greater oversight and efficiency our operations,efficiency,2
301,writing about canceling account not beein able take payment,"account,",0
302,spent years dba not going expect this have the raw power mariadb oracle but for little shared synchronized database airtable treat use,database,1
303,there are many bugs the latest version,bugs,0
304,sometimes tightens lately can not update,update,0
305,acts like version webpage whereas must default interface with loading and only the user edited information changing,webpage,0
306,vegetables quality need improve,Vegetables,0
307,missing offline mode,offline mode,0
308,overall good please widget feature for android widget make easier know our tasks home screen without open the,widget,0
309,already listed the link sent,listed,1
310,the video not uploading the video,upload,2
311,send the products that you have charged for,products,0
312,cash dilivery price items,dilivery,0
313,apke product price,product,0
314,being able write notes comput,notes,2
315,visa and billing address stargarder weg gottingen,Billing,1
316,supr access then automatically supr access should activated and help the customer for full month waiver service fees despite bringing the knowledge you nothing happened feel like discontinuing,"service fees,",0
317,please change the emojis android and please make the animation opening closing pages smoother android,"android,",0
318,not able use notion for mobile now,notion,0
319,you try the mobile first you might not like notion you should try the web desktop the full power notion and keep the mobile view and simple edits your projects,desktop app,2
320,however does not support widget which makes quickly adding tasks information difficult,widget,0
321,this works great but could you please please audio alert,audio,0
322,very useful note ever seen,app,2
323,think this will work but can you just wait few minutes download and check,download,2
324,got problem adding images from istock,images,0
325,delivery time,Delivery,2
326,evernote clips stuff just fine,Evernote,2
327,vistaplus workspace,Workspace,2
328,not opening just shows its logo centre and that,centre,0
329,products availability delivery delivery time discounts offers,"delivery time,",0
330,can you tell the best price you can offer for the unlimited plan year,offer,2
331,the best note taking have ever had,note taking app,2
332,want renew this year have not really used for the last year,renew,0
333,notion has have tasks lists sprint planning shared lists docs general notes one place,"shared lists,",2
334,best productivity tool,tool,2
335,switched incognito and that worked for while,incognito,1
336,like the ease setting inventory and the ability take pictures each item,inventory,1
337,think that airtable very wonderful tool bringing together some the best features different like tremolo slack and excel,excel,1
338,wish edit video already have gallery,gallery.,1
339,love this request the dev make something like widget the checklist todo will easier check them,widget,0
