,text,aspect,label
2891,you want boost sales functions boom you want manage marketing functions bang you want handle service functions bam any other function your have system for run your business can organized tracked and measured with aidtable spreadsheets flex you can even automate workflows with blocks airtable automation tool feature encourage any person working your company build their own with airtable there much you can with this register for free account and templates search for okr tracking and create key results improve your business now,Search,1
2892,day trial like the other plans would work perfect,trial,2
2893,and then the format completely changed and lost the the table format,data,0
2894,want remove the first sec the video imported,IMPORTED,1
2895,easy place order with excellent delivery,delivery,2
2896,but switched unlimited the promo code was good for plans,plans.,1
2897,but the could have better mobile interface more gesture integration quick actions and widgets,widgets).,0
2898,when order confirmed please ensure that delivered and not canceled,delivered,0
2899,best feature rich productivity ever,app,2
2900,the fruits and veges are poor quality also the fruits and veges are damp inside the cover,fruits,0
2901,this has made more productive and more able focus what important than any other,app.,2
2902,delivery charges are high,Delivery charges,0
2903,please make delivery charges free for grocery milk,grocery,0
2904,you can replace with premium media and export you want,media,0
2905,this has one the best apps have ever used since issuing have grown huge company,company,2
2906,mean equip fidouat and send them with dough price according their quality,price,1
2907,the mobile also little laggy,mobile app,0
2908,love asana but latest updates take the many steps backwards,latest updates,0
2909,almost everyday need call your support for missing items damaged expired items delivered,missing items,0
2910,good,app,0
2911,the best for team management,team,1
2912,fraud company paid for days and received milk only for days and proper response from customer support,milk,0
2913,some more offers for old customers,offers,0
2914,need delivery time time,delivery,0
2915,typeoneerror notionhq obsdmd could you sync them with the notionapi,sync,1
2916,best management tool,Best,2
2917,haptics sound design and responsive gesture animation are like drug for,animation,0
2918,days since someone asked for notionhq offline mode,offline mode,1
2919,five months subscribe milk,milk,0
2920,repeatedly crashes when changing filtered view ios,view,0
2921,julie from this screen will have move the correct date click the switch include the time,switch,1
2922,however not way custom templates notion without submitting them the global notion template gallery,Gallery?,1
2923,this really great database and extremely easy get grips with,database,2
2924,need gallery view ios maybe can use ipad browser check which right now can only login but not from ipad browser,browser,0
2925,charging delivery the milk packets,delivery fee,0
2926,free trial can only accessed with card but seems you are getting error,free,2
2927,prompt service great product line,Prompt service,2
2928,well you will have manually adjust the duration media and text after adding into the scene every time,scene,1
2929,notionanswers notionhq you can filter tasks then the table footer check the number,Filter,1
2930,besides that this one the best note taking apps,note taking apps!,2
2931,notionhq can you pls adopt google calendar bar thing that let you know what time,google,1
2932,could one those users with access the beta program,Beta,1
2933,use organize stories and submissions,organize,1
2934,image only filling the center screen,screen,1
2935,this for taking notes,app,0
2936,where can download video computer phone,computer,1
2937,when you have link preview column and try make the width,preview,1
2938,someone who visually impaired would great able increase the text size,text,0
2939,air table great for organizing stamps and dies,stamps,1
2940,relogin now with the same email and use the password invideo,password,0
2941,please voice capabilities speech synthesis and the ability record your voice,record,1
2942,yes you are already free trial and can export video without watermark,free,2
2943,work project manager and was doing things the hard way for years with spreadsheets and other organizational aides that took just long put together the actual project,project,1
2944,not have laptop computer anymore only ipad,iPad,1
2945,soon open the just stays logo with white background please help know this great,logo,0
2946,and need edit just download quality,download,1
2947,any particular brand item not available while advising that the item not available you can mention the other available brand the same item the same message,particular brand,0
2948,you are the professional plan look the article above,plan,1
2949,can help you make weekly schedules lists pages for your subjects helpful templates upload files and take down notes,"lists,",2
2950,tried use upload file but couldn get attachment column table open,attachment,0
2951,love this functionality this but mortified discover that will not even load without internet connection,app,2
2952,delivery person does not call before leaving milk and vegetables outside near the main road since the independent house the main road,milk,0
2953,would easier share the other database,share,1
2954,excellent sorry just not meet him before,meet,1
2955,the best notes have ever used,app,2
2956,best ever combination the powerful apps best tool for documentation,app,2
2957,the delivery high myself want discontinue,delivery fee,0
2958,service delivery products,Service,2
2959,writing request access the notion api beta that can try out the automate integration,integration.,2
2960,have you uploaded your logo the uploads tab,logo,0
2961,wish the ipad was good the computer,IPad app,2
2962,clearly the best note taking have ever used,note,2
2963,cancelled subscription because not want pay the tax for year,subscription,0
2964,doubt one the best apps have ever used not the best,apps,2
2965,they hare now not showing either workspace,workspace?,1
2966,does not allow login you have login error window displayed for login but immediately login options disappear,login,0
2967,can not even start the displays the logo and visible indication what happening loading bar spinning animation text nothing,"spinning animation,",0
2968,time delivery and prompt customer service,customer service,2
2969,but the slow the phone and tablet that feels like the screen has crashed,tablet,0
2970,check out your facebook page how disgusting this company sharing your usage with them,sharing,0
2971,this biggest database,database,2
2972,switching from notionhq obsdmd due recent availability issues and planned offline mode for the near futu,Switching,0
2973,love notion whole but the quality the ease use needs significantly improve,ease of use,0
2974,service not upto mark,Service,0
2975,compared other apps like milkbasket daily offers are less,apps,0
2976,found this when became compatible with siri shortcuts was struggling connect with shortcut and reached out the developers for some assistance the itself great everything you could hope totally user friendly simple and streamlined and also capable handling very complex and intricate applications well also cross platform can truly accessible back story was met promptly with loads help and when responded with some well deserved praises was given some swag with very sincere hand written thank you say this not that everyone reaches out get frustrated you don get the response but point out how important this company the people who created this and was done knowing that the user what will help catapult the company forward doing exactly what they have done create amazing product and ensuring runs very smooth sucheta you rock and thanks for your help best wishes,Totally user friendly,2
2977,love notion but the desktop and android apps are slow and frequently crash,Android apps,0
2978,the crashed once for this extremely simple task ipad pro,iPad Pro 11.,0
2979,pathetic customer service,customer service!,0
2980,works well windows but just installed phone android,(Android 7),0
2981,love this and the idea behind,app,2
2982,the vegetables fruits ordered out few times were not good quality and not fresh,quality,0
2983,unlimited videos exports month unlimited premium videos month,Premium,2
2984,not use russian until you can use russian,Russian,1
2985,just trying edit download video,edit,1
2986,transferring writings from mac notes notionhq makes feel,Mac,1
2987,there dark mode the works for the web version the,web,0
2988,alexandrecadeau notionhq notion great tool for building product roadmap you will actually use,roadmap,2
2989,also ahead and make widgets for notification center macos,macOS.,0
2990,unfortunately the boot time for this very slow,app,0
2991,remove acess membership and service,service fee.,0
2992,best productivity ever,app,2
2993,installed notion phone after having tried the web version,Notion,0
2994,one the best the best the market but the cost still very high,cost,0
2995,istock website and search and find picture videot here possible find same here plataform,website,1
2996,customer service awful delivery people not ring bell after multiple complaints money got deducted but not reflect your and way raise that issue with support,app,0
2997,however when hide the sidebar switch between full screen text shifts meaning that does not align with the corresponding slide picture,"screen,",1
2998,could you ability create widgets that the only thing miss the,"widgets,",0
2999,notion good but not good plz improve mobile apps takes time open,mobile apps,2
3000,the least you can extend the suupr access subscription for failed deliveries,suupr access subscription,0
3001,your delivery avin milk packets have been undepedable,Avin milk packets,0
3002,awesome,app.,2
3003,edit they implemented correct views for mobile,mobile,1
3004,delayed delivery time,Delivery time,0
3005,yes trimmed and ready,trimmed,1
3006,let try with other browser,browser,1
3007,dolar for discount much you can,discount,2
3008,how about toggle control contorl number list control,list,1
3009,now just received the desktop email and was interested the point where only supported win and mac,desktop,2
3010,the takes long time load android which makes difficult quickly take notes ideas the,app,2
3011,thought cancelled last week,cancelled,1
3012,implement free delivery charges give some discounts recharging monthly,delivery charges,0
3013,would like select multiple select options instead one,select multiple,1
3014,airtable amazing product desktop,desktop,2
3015,icon the bottom report any bugs you them,bugs,0
3016,like going back time using this,app.,0
3017,guess not hip enough have workflow interrupted relyi,workflow,0
3018,really like this service but can not get the information the mobile version match synchronize with the information the version,PC version.,0
3019,asana has been god send can visually what need for online courses creating clients home everything,clients,1
3020,but support for right side alignment like most note apps,apps.,2
3021,items grocery vegetables price are very high,grocery/Vegetables price,0
3022,not reminders tasks the free version,free,1
3023,love this help many ways with new project,project,1
3024,use firefox entirely and for some reason they have stopped working,Firefox,0
3025,best for keeping track multiple things you need,keeping track,2
3026,prevents users from customizing the,app.,0
3027,good service useful for covid safe home,service..,2
3028,and plan subscribe the one,subscribe,1
3029,please dark mode,dark mode,0
3030,should work offline,offline,1
3031,can you delete the account free,account,1
3032,supr known for delivery charges,DELIVERY CHARGES.,0
3033,your google login incognito does not work,INCOGNITO,0
3034,robscott notionhq switched from and have not looked back,switched,1
3035,well really like the and although first was bit confused and overwhelmed about how use,app,0
3036,this going that one that changes everything,APP,2
3037,although complicated first because has many functions quite complete even the free version,free,1
3038,everyone does not have the latest apple product,Apple,1
3039,not use this want delete account,account,1
3040,maintaining regularity and prompt delivery,prompt delivery.l,0
3041,perhaps one the most awesome that has been developed the developers,app,2
3042,plz work the prices offered fruits and vegetables,vegetables,0
3043,timely delivery needed and worst customer support improve,"customer support,",0
3044,apke product price,price,0
3045,delivery time and delivery charges,delivery charges.,0
3046,for some time was looking for like this with templates ready for some jobs,templates ready,2
3047,can not log,log,0
3048,the website far far better,website,2
3049,having issue where each callout created displaying red text instead the default color,text,0
3050,sorry the lifetime plan for business,business?,1
3051,being professional and hobbyist software developer love this very much,developer,1
3052,please feel free reach out anytime you have any questions suggestions feedback,free,1
3053,this intended behavior the moment while copying link pages and paste and definitely agree that this needs some polishing,paste,0
3054,this has the most functionality have ever seen note meeting workspace whatever you want call,note/meeting/workspace,2
3055,thought had already cancelled prior the trial being over but just noticed the payment,payment,0
3056,one more question how can change the style transition from scene scene,scene?,1
3057,but paying annually can get access some differentiated custom structures,paying,1
3058,would great had homesreen widget link specific page favorites quick note etc,specific page,0
3059,can you send mail for the confirmation the same,mail,1
3060,would really great you this ability the,app.,2
3061,automated text speech,Text,2
3062,you don get push notifications for your phone,notifications,1
3063,miriamgonp notionhq voy registrando una tabla logros voy anotando los reconocimientos,una,1
3064,and let make organize notes better than any other,app.,0
3065,have already sent message before typing slow notion,slow,0
3066,installed the but when open the displays the logo with white screen,app,2
3067,any video longer than mins will take longer export,export,0
3068,examples might content within page entire page pages entire workspace entire notion account can you also share any relevant page workspace urls names other identifying information,share,1
3069,using this for side project for work,project,1
3070,the new updated version the not working,updated,0
3071,but not quite sure management would agree purchase for each member the team,purchase,1
3072,the right animation duration,animation,1
3073,the more than wonderful but have two notes the first that the can not modify the name tables some fields where when pressing write enlarges and minimizes the options frequently and annoyingly and the second hope that the writing feature the arabic language will added from right left thanks lot,app,0
3074,hastle free services milk fruits and vegetables,"milk,",2
3075,communicating clear msg,communicating,0
3076,prompt efficient and good quality service,efficient,2
3077,only thing need android widget,android widget,0
3078,the moment creating the same view the table that you arranged alphabetical order and with regular width not yet possible with our link feature,table,0
3079,you will have download from youtube and then upload and the scene,youtube,1
3080,failing log and paid specifically using mobile very bad,mobile,0
3081,and another question that means remove background credits,background,1
3082,thanks for work addressing initial feedback way slow mobile,mobile.,0
3083,improve your application crashed issue,Improve,0
3084,when will dark mode the android,android,1
3085,please more variety leafy vegetables,variety of leafy vegetables,0
3086,cet for very special session how use notionhq with raes tea,how to use,2
3087,need widgets pinned pages and offline pages please provide wigets android,wigets,0
3088,how can change the home language,home language,0
3089,very bad service not delivered many times,service,0
3090,need reduce delivery cost can buy almost liters milk with amount charged for delivery per month,milk,0
3091,notion easily one the best apps have used entire life,Notion,2
3092,the page called topic finance and accessed through hsc year business studies class notes topic finance,"notes""",0
3093,can anyone tell how adjust the size the texts,texts,0
3094,not take advantage the situation and suddenly charges like done now the timing could have been post lockdown for charges and ensure everyone gets atleast one packet milk even they have ordered for more that distribution happens equally,charges,0
3095,set the fit type fit with transparent,transparent,1
3096,how can the mobile terrible when the desktop has much versatility,mobile app,0
3097,please can you lookinto project,Project,1
3098,but yet not got the super daily delivery bag,Delivery bag.,0
3099,well for now going take the monthly plan because the truth have lot development expenses find bit difficult this month but take the option into account because the moment one platforms starts generate that will throughout the month may and june,"plan,",1
3100,little awkward get started try understand how relationships are establish but you have absolutely database experience you may have easier time the people who have used access corral paradox,database,1
3101,have lifetime deal invideo,lifetime,2
3102,really helpful templates and project bases with sample that makes sense their potential uses,Really helpful templates,2
3103,very good prompt service keep oedy,service,0
3104,delivery charges should nil,Delivery charges,0
3105,airtable was breath fresh air after decades google sheets but starting show its age multiple views are broken mobile one can edit notes sections because the keyboard covers the viewport pro usually not terrible unless editing one the bottom three fields but the useless mini,Multiple views,0
3106,looking more delivery timing well assured the delivery,delivery timing,0
3107,would like downgrade account temporarily from business free not using the moment,business,1
3108,excellent for note taking and cross platform usability,app,2
3109,great order projects and tasks,tasks,2
3110,ease use and polite delivery people,polite delivery people,2
3111,could crop some scenes but not preview,preview,0
3112,dear can not seem download video without watermark have upgraded plan but still bad quality,quality,0
3113,prioritize tasks,tasks.,1
3114,gosto versao pra web,Gosto,2
3115,also there anyway able edit videos longer than min,edit,1
3116,difficult type every time have option use touch pen apple pencil pen iam more pleasurable you make this the,Pen,0
3117,the current delivery charges are the higher side,delivery charges,0
3118,there new feature ultimate tasks notionhq template cold tasks,template,2
3119,you can change the email,email,0
3120,you are not the recipient indicated you are notified that the use disclosure and copying without authorization prohibited under current legislation,notified,0
3121,the quality fruits vegetables have been lowered,fruits,0
3122,once have placed order then there should not any change prices,prices.,0
3123,believe great feature would allow the user attach near unlimited images the notes one your lists,lists,1
3124,the customer understand customer problem,customer problem,0
3125,ensure quality and timely delivery,quality,0
3126,need editing and upload the cloud,cloud.,1
3127,please optimize your for android,android,0
3128,can generate video for facebook ads facebook story ads instagram video ads,ads,1
3129,was happy with notion the moment learned about and had hands,notion,2
3130,notion the best note apps have ever used,Notion,2
3131,love this tool,tool!!,2
3132,the haptic feedback vibration quite weird,haptic feedback vibration,0
3133,does not hold settings,settings,1
3134,notion team any way create template database with default date property today,template,1
3135,otherwise good for milk supply,milk,0
3136,the best productivity ever,app,2
3137,can you send the payment link here,payment,1
3138,quality delivery and time delivery check the delivery person who delivering the product properly delivering quality product,delivery,0
3139,apparently per policy that you want subscribe the educational plan you will needing associate your eligible student email along with,student,1
3140,offers cashback promotions product discounts while starting you given more discounts but now nothing watse,cashback promotions,0
3141,sometimes slow during meetings switch back google docs,Google,1
3142,freezes the splash screen,splash screen.,0
3143,would like notified whenever fixed possible,notified,1
3144,duplicating templates does not work anymore,Templates,0
3145,visa mastercard amex credit card,card,1
3146,notion incredible desktop but unusable android the takes just move beyond the splashscreen,Android,0
3147,helped get job with the team,team,1
3148,does that only appear when video has been exported,exported,1
3149,cannot select multiple items the which super easy the website,"app,",0
3150,takes long open seconds that usually give before loads,long,0
3151,long time open trash,APP,2
3152,installed notion but never worked,Notion,0
3153,using browser from apple phone,phone,1
3154,the leaves lot desired compared the desktop version,desktop,1
3155,submission posting attachment with text always separate post can not combine like posting from desktop,desktop,1
3156,must support androids multi window api would better tablets and resize the the screen,app,0
3157,that notion really well thought out and intuitive note taking,app.,2
3158,slowly after display content,slowly,0
3159,would helpful have kanban view mobile,mobile,1
3160,steps turn notionhq into the ultimate design inspiration system,design,2
3161,like notion the mac web but the mobile way slow,Mac/web,2
3162,when adjust premium media show also remove watermark,media,0
3163,have already set pages have small text but the mobile the text large that can barely few lines,"text,",2
3164,why can not open the,app?,0
3165,this new timeline feature something had been waiting eagerly for while since great tool able keep track the progress each project,project.,1
3166,another video made yes the issue occur after downloaded also,downloaded,1
3167,yes keep deleting the logo place marker the right the screen but keeps reappearing,screen,1
3168,first suggest adding zoom option maybe with option switch for some people,zoom option,0
3169,buggy new samsung tab,Samsung,1
3170,need bag but they are provided any bag have wake take the milk,milk,0
3171,service should improved,Service,0
3172,try give regular deliveries,regular deliveries,0
3173,also you started charging delivery charges without any intimation,delivery charges,0
3174,enjoy notion desktop very much but its mobile android virtually unusable,Notion,2
3175,prompt and efficient service,efficient service,2
3176,notionhq editing manually also does not update the sum,Editing,0
3177,notionhq can protect notion contents with password code either mobile computer,password,1
3178,wish you could emoji react documents notionhq,emoji,2
3179,but fed ofasking green insulated super bag since last months despite calling customer care for getting bag company not bothred give bag totally dissatisfied company,super bag,0
3180,love notion and the ipad keeps most the features from desktop totally functional for everyday updates and note taking,app,2
3181,not like our phones are slow anything but more with the optimization,app optimization.,2
3182,best for database,database,2
3183,have bought ltd from appsumo while ago but now prompted for buying subscription,bought,1
3184,smartsheets trello combined into one,Smartsheets+,0
3185,the most important tools digital ecosystem are time blocked gcal,blocked,0
3186,improve payment technique,payment technique,0
3187,amazing loving the layouts,app,2
3188,that turn the volume for just that one scene,scene?,1
3189,love notion but the terrible,Notion,2
3190,orders payments are being accepted from mobile registered with you but when comes contacting customer service for raising issues getting message that this mobile not registered one,Customer Service,0
3191,service the way you reach out your customers and notify them regarding your ground operational challenges,Service,2
3192,can you increase the upload file size gigs,upload,1
3193,guys correct locales ukraine downloading the application polish although previously everything was correct,downloading,1
3194,most the time hangs making the subscriber fatigue,Most of the time it hangs,0
3195,best productivity ever,APP,2
3196,including the loading speed and display layout,display layout.,0
3197,could get refund cancelled before april,refund,0
3198,have deleted the account you will need resend invitation and accept again,account,1
3199,would appreciate linux support,support.,2
3200,just would like have the option create columns inside toggle feature would really elevate productivity game please consider,toggle,1
3201,that done please logout and relogin with same password,login,1
3202,signed brief trial asana but decided was not for compared alternative option found,signed,1
3203,original sound not playing,sound,1
3204,select the video clip the scene and you will get the volume option the right panel,volume,0
3205,much loading but used for daily using web version,web version,1
3206,but notion has ever missing feature have ever wanted,Notion,2
3207,would really great there were ipad version for notion that supports drawing screen splitting,iPad version,2
3208,remove supr access and make free delivery,delivery.,0
